date,source,ticker,company,strategy,conviction,entry_price,headline
2026-04-08,AI-Judge,HALO,Halozyme Therapeutics,Quality Compounder,HIGH,65.45,Every major pharma company pays Halozyme a royalty to turn an IV drug into a con
2026-04-08,AI-Judge,PEGA,Pegasystems Inc.,Fast Grower,HIGH,41.69,Fortune 500 companies build their entire customer service operations on Pega — t
2026-04-08,AI-Judge,DOCS,"Doximity, Inc.",Stalwart,HIGH,22.04,"80% of US physicians use Doximity every day — it's LinkedIn for doctors, and pha"
2026-04-08,AI-Judge,ADBE,Adobe Inc.,Stalwart,HIGH,240.81,The most dominant creative software ecosystem ever built now trades at a cheaper
2026-04-08,AI-Judge,QLYS,"Qualys, Inc.",IV Discount,HIGH,86.91,A cloud security monopoly with 45% FCF margins trading at a 72% discount to its 
2026-04-08,AI-QualityGrowth,PEGA,Pegasystems Inc.,Enterprise workflow automation platform with deep ,HIGH,41.69,PEG=0.8 with ROIC=29% and EG5y=24%
2026-04-08,AI-QualityGrowth,ADBE,Adobe Inc.,Dominant creative and document cloud ecosystem wit,HIGH,240.81,ROIC=37% with PE=13.7 and FCFMargin=42%
2026-04-08,AI-QualityGrowth,QLYS,"Qualys, Inc.",Cloud-native security platform with high renewal r,HIGH,86.91,MoS=72% with ROIC=28% and FCFMargin=45%
2026-04-08,AI-QualityGrowth,DOCS,"Doximity, Inc.",Network effects among 80%+ of US physicians create,HIGH,22.04,GrMgn=90% with FCFMargin=48% and ROIC=20%
2026-04-08,AI-QualityGrowth,HIG,The Hartford Financial Service,Pricing power in specialty commercial insurance an,HIGH,138.63,PEG=0.8 with ROIC=28% and FCF=15%
2026-04-08,AI-QualityGrowth,HALO,"Halozyme Therapeutics, Inc.",Proprietary ENHANZE drug delivery technology licen,HIGH,65.45,PEG=0.6 with GrMgn=82% and FCFMargin=46%
2026-04-08,AI-QualityGrowth,NTES,"NetEase, Inc.",Deep IP moat in Chinese gaming with proprietary de,MEDIUM,114.39,NetCash=+220% with FCFMargin=43% and ROIC=17%
2026-04-08,AI-CapAppreciation,PEGA,Pegasystems Inc.,Revenue re-accelerated sharply to +17% vs +5% prio,HIGH,41.69,PEG=0.8 with RG accelerating from +5% to +17%
2026-04-08,AI-CapAppreciation,DLO,DLocal Limited,Explosive revenue re-acceleration to +47% vs +15% ,HIGH,12.87,RG jumped from +15% to +47% with MoS=85%
2026-04-08,AI-CapAppreciation,PTCT,"PTC Therapeutics, Inc.",Massive revenue inflection to +115% from -14% prio,HIGH,71.24,RG inflected from -14% to +115% with PE=8.2
2026-04-08,AI-CapAppreciation,HALO,"Halozyme Therapeutics, Inc.",Revenue accelerating to +38% from +22% as ENHANZE ,HIGH,65.45,PEG=0.6 with fwd PE=7.6 vs trailing 23.6 and OprMgn=58%
2026-04-08,AI-CapAppreciation,CNX,CNX Resources Corporation,Natural gas price recovery driving revenue inflect,MEDIUM,38.22,RG inflected from -8% to +59% with PE=8.5 and PEG=0.5
2026-04-08,AI-CapAppreciation,DOCS,"Doximity, Inc.",Revenue re-accelerating to +20% from +13% as pharm,HIGH,22.04,RG accelerated from +13% to +20% with FCFMargin=48% and NetCash=+22%
2026-04-08,AI-CapAppreciation,HRB,"H&R Block, Inc.",Seasonal earnings catalyst imminent as tax season ,MEDIUM,32.07,PE=6.7 with PEG=0.5 and ROIC=30% during peak tax season catalyst
2026-04-08,AI-EmergingGrowth,DLO,DLocal Limited,DLocal is building the dominant emerging-market pa,HIGH,12.87,RG=+47% with ROIC=29% and FCF yield=11% at $3.8B market cap
2026-04-08,AI-EmergingGrowth,DOCS,"Doximity, Inc.",Doximity has achieved near-total penetration of U.,HIGH,22.04,GrMgn=90% with FCFMargin=48% and RG accelerating to +20% from +13%
2026-04-08,AI-EmergingGrowth,DUOL,"Duolingo, Inc.",Duolingo's gamified language-learning platform is ,HIGH,92.47,RG=+39% sustained (41% prior year) with FCFMargin=36% at $4.3B market cap
2026-04-08,AI-EmergingGrowth,RELY,"Remitly Global, Inc.",Remitly is displacing legacy wire-transfer incumbe,HIGH,16.46,FCFConv=4.3x with MoS=85% and RG=+29% at $3.5B market cap
2026-04-08,AI-EmergingGrowth,RDDT,"Reddit, Inc.",Reddit owns the internet's most authentic communit,HIGH,145.7,RG=+69% (accelerating from +62%) with GrMgn=91% and fwd PE=9.7x vs trailing 50x
2026-04-08,AI-EmergingGrowth,PEGA,Pegasystems Inc.,Pegasystems is at an inflection point converting i,MEDIUM,41.69,ROIC=29% with PEG=0.8 and RG accelerating to +17% from +5%
2026-04-08,AI-EmergingGrowth,HALO,"Halozyme Therapeutics, Inc.",Halozyme's ENHANZE drug-delivery technology has be,MEDIUM,65.45,RG=+38% (accelerating from +22%) with FCFMargin=46% and PEG=0.6 at $7.7B market 
2026-04-08,AI-SpecialSit,NTES,"NetEase, Inc.",Market prices NTES as a Chinese tech regulatory ri,HIGH,114.39,NetCash=+220% of price; PE=14.5 for a 22% ROE compounder
2026-04-08,AI-SpecialSit,HALO,"Halozyme Therapeutics, Inc.",Market misclassifies Halozyme as a speculative bio,HIGH,65.45,PEG=0.6; fwd PE=7.6 vs trailing 23.6 as royalty revenue inflects
2026-04-08,AI-SpecialSit,QLYS,"Qualys, Inc.",Classic IV discount where a near-monopoly cloud se,HIGH,86.91,MoS=72% DCF discount with FCFMargin=45% and DE=0.2
2026-04-08,AI-SpecialSit,HRB,"H&R Block, Inc.",Structural mis-pricing: H&R Block is a subscriptio,HIGH,32.07,"PE=6.7, FCF=13%, ROIC=30%—one of cheapest quality franchises in the universe"
2026-04-08,AI-SpecialSit,DLO,DLocal Limited,Market is pricing DLO as a volatile EM fintech wit,HIGH,12.87,"RG=+47% accelerating from +15%, PEG=0.8, MoS=85%"
2026-04-08,AI-SpecialSit,PTCT,"PTC Therapeutics, Inc.",Profound business model inflection: PTCT transform,HIGH,71.24,"PE=8.2 with OprMgn=49%, FCFMargin=40%, ROIC=37%—priced as speculative biotech"
2026-04-08,AI-SpecialSit,DUOL,"Duolingo, Inc.",Classic turnaround mis-pricing: Duolingo crossed i,MEDIUM,92.47,PE=10.8 post-profitability inflection with MoS=76% and RG=+39%
2026-04-09,AI-Judge,HALO,Halozyme Therapeutics,Quality Compounder,HIGH,66.54,The market prices this like a biotech — it's actually a royalty toll booth on th
2026-04-09,AI-Judge,DOCS,"Doximity, Inc.",Stalwart,HIGH,21.45,LinkedIn for doctors with 90% gross margins — pharma can't reach 80% of US physi
2026-04-09,AI-Judge,DLO,DLocal Limited,Fast Grower,HIGH,13.09,The payments rails for 40+ emerging markets — growing 47% with 29% ROIC at PEG 0
2026-04-09,AI-Judge,PEGA,Pegasystems Inc.,Quality Compounder,HIGH,39.29,"Mission-critical AI decisioning software growing at 17%, ROIC of 29%, PEG of 0.8"
2026-04-09,AI-Judge,QLYS,"Qualys, Inc.",IV Discount,HIGH,79.29,Best-in-class cybersecurity SaaS at a 75% DCF discount — the market ignores it b
2026-04-09,AI-QualityGrowth,PEGA,Pegasystems Inc.,29% ROIC with PEG 0.8 signals a deeply undervalued,HIGH,39.29,PEG=0.8 with ROIC=29% and FCFMargin=28%
2026-04-09,AI-QualityGrowth,ADBE,Adobe Inc.,37% ROIC sustained at $94B market cap proves a str,HIGH,229.88,ROIC=37% with GrMgn=89% and FCFMargin=42%
2026-04-09,AI-QualityGrowth,QLYS,"Qualys, Inc.",28% ROIC at a 75% DCF discount with PEG 1.6 repres,HIGH,79.29,MoS=75% with ROIC=28% and FCFMargin=45%
2026-04-09,AI-QualityGrowth,HALO,"Halozyme Therapeutics, Inc.",Halozyme's ENHANZE drug-delivery technology is a s,HIGH,66.54,PEG=0.6 with OprMgn=58% and FCFConv=2.0
2026-04-09,AI-QualityGrowth,DOCS,"Doximity, Inc.",Doximity's network of 80%+ of US physicians create,HIGH,21.45,GrMgn=90% with FCFMargin=48% and NetCash=+22%
2026-04-09,AI-QualityGrowth,HIG,The Hartford Financial Service,Hartford's commercial lines underwriting superiori,HIGH,140.47,PEG=0.8 with ROIC=28% and FCF=15%
2026-04-09,AI-QualityGrowth,FICO,Fair Isaac Corporation,FICO's 51% ROIC reflects an unassailable regulator,MEDIUM,1067.94,ROIC=51% with OprMgn=47% and FCFMargin=36%
2026-04-09,AI-SpecialSit,NTES,"NetEase, Inc.",Market prices this as a China-risk tech stock but ,HIGH,113.48,NetCash=+222% of price with PE=14.5 and FCF yield=10%
2026-04-09,AI-SpecialSit,HALO,"Halozyme Therapeutics, Inc.",Classic business model misclassification: market p,HIGH,66.54,FwdPE=7.8 vs TrailingPE=23.6 with FCFMargin=46% and PEG=0.6
2026-04-09,AI-SpecialSit,QLYS,"Qualys, Inc.",A capital-light cybersecurity SaaS with 83% gross ,HIGH,79.29,MoS=75% with FCFMargin=45% and DE=0.2
2026-04-09,AI-SpecialSit,PTCT,"PTC Therapeutics, Inc.",Revenue inflected from -14% to +115% YoY following,HIGH,71.41,RG=+115% with OprMgn=49% and PE=8.2 at FCF=12%
2026-04-09,AI-SpecialSit,DUOL,"Duolingo, Inc.",Misclassified as an unprofitable growth app — it h,MEDIUM,89.61,PEG=0.7 with FwdPElook implied and MoS=77%
2026-04-09,AI-SpecialSit,DLO,DLocal Limited,Emerging-market payments infrastructure business (,HIGH,13.09,MoS=84% with RG accelerating to +47% and ROIC=29%
2026-04-09,AI-SpecialSit,HRB,"H&R Block, Inc.","Hidden FCF machine: PE=6.7, FCF yield=13%, ROIC=30",HIGH,30.8,PE=6.7 with FCF=13% yield and ROIC=30% at MoS=76%
2026-04-09,AI-CapAppreciation,PEGA,Pegasystems Inc.,Revenue re-accelerated sharply to +17% from +5% wi,HIGH,39.29,PEG=0.8 with RG accelerating from +5% to +17% and 76% gross margin
2026-04-09,AI-CapAppreciation,DLO,DLocal Limited,Revenue exploded from +15% to +47% with PEG=0.8 an,HIGH,13.09,MoS=84% with RG surging to +47% and ROIC=29% at PEG=0.8
2026-04-09,AI-CapAppreciation,HALO,"Halozyme Therapeutics, Inc.",Revenue re-accelerated to +38% from +22% with PEG=,HIGH,66.54,PEG=0.6 with fwd PE=7.8 vs trailing 23.6 and FCFConv=2.0
2026-04-09,AI-CapAppreciation,PTCT,"PTC Therapeutics, Inc.",Revenue surged +115% from -14% prior year with PE=,HIGH,71.41,PE=8.2 on +115% revenue growth with 91% gross margin and ROIC=37%
2026-04-09,AI-CapAppreciation,CNX,CNX Resources Corporation,Revenue re-accelerated from -8% to +59% with PEG=0,MEDIUM,38.9,PEG=0.5 with RG going from -8% to +59% and FCF yield=9%
2026-04-09,AI-CapAppreciation,DOCS,"Doximity, Inc.",Revenue accelerated to +20% from +13% with zero de,HIGH,21.45,RG accelerating to +20% with 48% FCF margin and AltZ=16.80
2026-04-09,AI-CapAppreciation,HRB,"H&R Block, Inc.",Trades at PE=6.7 and MoS=76% with 30% ROIC and 13%,MEDIUM,30.8,PE=6.7 with MoS=76% and ROIC=30% at PEG=0.5
2026-04-09,AI-EmergingGrowth,DLO,DLocal Limited,DLocal is the dominant emerging-market payments in,HIGH,13.09,RG=+47% with ROIC=29% and PEG=0.8 — fastest-growing at the cheapest valuation-ad
2026-04-09,AI-EmergingGrowth,RDDT,"Reddit, Inc.",Reddit owns the internet's largest repository of a,HIGH,138.96,RG=+69% (accelerating from +62%) with GrMgn=91% and FCFMargin=31%
2026-04-09,AI-EmergingGrowth,DUOL,"Duolingo, Inc.",Duolingo's gamified language learning platform has,HIGH,89.61,RG=+39% with PEG=0.7 and MoS=77% — high-growth compounding at deep discount to i
2026-04-09,AI-EmergingGrowth,RELY,"Remitly Global, Inc.",Remitly is displacing Western Union and MoneyGram ,HIGH,16.94,FCFConv=4.3 with RG=+29% and MoS=85% — unit economics dramatically improving as 
2026-04-09,AI-EmergingGrowth,DOCS,"Doximity, Inc.",Doximity is the LinkedIn of US physicians with 80%,HIGH,21.45,GrMgn=90% and FCFMargin=48% — best-in-class unit economics with a defensible pro
2026-04-09,AI-EmergingGrowth,HALO,"Halozyme Therapeutics, Inc.",Halozyme's ENHANZE drug delivery technology is a c,HIGH,66.54,OprMgn=58% with RG=+38% and PEG=0.6 — royalty model with near-zero marginal cost
2026-04-09,AI-EmergingGrowth,ESTC,Elastic N.V.,Elastic's search-powered observability and securit,MEDIUM,46.23,ROIC=61% with GrMgn=76% and NetCash=+17% — exceptional capital efficiency in a l
2026-04-09,AI-CapAppreciation,CF,"CF Industries Holdings, Inc.",Revenue snapped from -10% to +19% as natural gas f,HIGH,121.12,PEG=0.4 with RG reversing from -10% to +19% into spring fertilizer demand peak
2026-04-09,AI-CapAppreciation,CRDO,Credo Technology Group Holding,Revenue surged from +5% to +126% as hyperscaler AI,MEDIUM,107.29,RG from +5% to +126% with fwd PE collapsing to 15.2 as AI infrastructure buildou
2026-04-09,AI-EmergingGrowth,PEGA,Pegasystems Inc.,Pegasystems is transitioning from legacy BPM softw,HIGH,39.21,PEG=0.8 with ROIC=29% and RG accelerating from +5% to +17%
2026-04-09,AI-EmergingGrowth,CRDO,Credo Technology Group Holding,Credo Technology is a pure-play beneficiary of the,MEDIUM,107.29,RG=+126% with GrMgn=68% and FwdPE=15.2 at Mcap=$19.8B
2026-04-09,AI-SpecialSit,PEGA,Pegasystems Inc.,Business model misclassification: market prices PE,HIGH,39.21,PEG=0.8 with EG5y=+24% and FCFMargin=28% — growth is being priced as if it will 
2026-04-09,AI-SpecialSit,DOCS,"Doximity, Inc.",Market treats Doximity as a social network vulnera,HIGH,21.3,FCFMargin=48% and GrMgn=90% with NetCash=+23% at PE=17.5 — monopoly network pric
2026-04-09,AI-SpecialSit,BZ,Kanzhun Limited,Hidden asset play: Kanzhun's operating business (B,MEDIUM,13.14,NetCash=+326% of market cap with GrMgn=85% and FCFMargin=40% — operating busines
2026-04-09,AI-Judge,PTCT,PTC Therapeutics,Fast Grower,MEDIUM,71.31,"Revenue exploded +115%, ROIC hit 37%, gross margins are 91%, and the stock trade"
2026-04-11,AI-Judge,HALO,Halozyme Therapeutics,Quality Compounder,HIGH,67.82,"The toll road inside Roche's, J&J's, and AstraZeneca's best-selling biologics — "
2026-04-11,AI-Judge,PEGA,Pegasystems Inc.,Fast Grower,HIGH,39.37,Enterprise automation software that banks and insurers cannot rip out — mid-tran
2026-04-11,AI-Judge,DOCS,"Doximity, Inc.",Quality Compounder,HIGH,21.05,"LinkedIn for doctors — 80% of US physicians already inside, pharma pays to reach"
2026-04-11,AI-Judge,DLO,DLocal Limited,Fast Grower,HIGH,13.12,The only compliant payment rail across 40+ emerging markets — misclassified as a
2026-04-11,AI-Judge,QLYS,"Qualys, Inc.",IV Discount,HIGH,76.2,A cybersecurity cash machine generating 46% FCF margins at 13x earnings — the ma
2026-04-11,AI-QualityGrowth,ADBE,Adobe Inc.,Irreplaceable creative and document cloud platform,HIGH,225.35,ROIC=37% sustained with FCFMargin=42% and FCFConv=1.4
2026-04-11,AI-QualityGrowth,PEGA,Pegasystems Inc.,Enterprise workflow automation with deep switching,HIGH,39.37,PEG=0.7 with ROIC=29% and FCFMargin=28%
2026-04-11,AI-QualityGrowth,QLYS,"Qualys, Inc.",Cloud-native security and compliance platform with,HIGH,76.2,MoS=76% with FCFMargin=46% and ROIC=28%
2026-04-11,AI-QualityGrowth,DOCS,"Doximity, Inc.",The dominant professional network for US physician,HIGH,21.05,FCFMargin=49% with GrMgn=90% and NetCash=+23%
2026-04-11,AI-QualityGrowth,HIG,The Hartford Financial Service,Best-in-class specialty commercial insurer with a ,HIGH,137.23,ROIC=28% with FCF=15% and PEG=0.8
2026-04-11,AI-QualityGrowth,HALO,"Halozyme Therapeutics, Inc.",ENHANZE drug-delivery technology is a royalty-gene,HIGH,67.82,OprMgn=58% with PEG=0.7 and FCFConv=2.0
2026-04-11,AI-QualityGrowth,FICO,Fair Isaac Corporation,The FICO score is a regulatory and institutional s,HIGH,922.37,ROIC=51% — highest durable moat signal in the entire candidate set
2026-04-11,AI-CapAppreciation,PEGA,Pegasystems Inc.,Revenue re-acceleration from 5% to 17% signals an ,HIGH,39.37,RG re-accelerated from +5% to +17% with PEG=0.7 and ROIC=29%
2026-04-11,AI-CapAppreciation,DLO,DLocal Limited,Revenue surged from +15% to +47% as emerging-marke,HIGH,13.12,RG re-accelerated from +15% to +47% with MoS=84% and NetCash=+19%
2026-04-11,AI-CapAppreciation,PTCT,"PTC Therapeutics, Inc.",Revenue exploded from -14% to +115% driven by Tran,HIGH,68.69,RG flipped from -14% to +115% with PE=8.1 and ROIC=37%
2026-04-11,AI-CapAppreciation,HALO,"Halozyme Therapeutics, Inc.",ENHANZE drug-delivery royalty pipeline is accelera,HIGH,67.82,FwdPE=7.7 vs trailing 25.2 with RG re-accelerating to +38%
2026-04-11,AI-CapAppreciation,DOCS,"Doximity, Inc.",Revenue re-accelerated from +13% to +20% as pharma,HIGH,21.05,FCFMargin=49% with RG re-accelerating from +13% to +20% at PE=16.5
2026-04-11,AI-CapAppreciation,CQP,"Cheniere Energy Partners, L.P.",Revenue flipped from -10% to +24% as LNG spot pric,MEDIUM,62.95,PEG=0.2 with RG turning from -10% to +24% and MoS=86%
2026-04-11,AI-CapAppreciation,CF,"CF Industries Holdings, Inc.",Revenue re-accelerated from -10% to +19% as natura,MEDIUM,121.28,RG turned from -10% to +19% with PEG=0.4 and MoS=62%
2026-04-11,AI-EmergingGrowth,DOCS,"Doximity, Inc.",The dominant professional network for U.S. physici,HIGH,21.05,FCFMargin=49% with RG accelerating from +13% to +20%
2026-04-11,AI-EmergingGrowth,DUOL,"Duolingo, Inc.",The world's largest language-learning platform wit,HIGH,90.03,RG=+39% sustained (vs +41% prior year) with 72% gross margin at $4.2B market cap
2026-04-11,AI-EmergingGrowth,RDDT,"Reddit, Inc.",Reddit's 69% revenue growth (accelerating from 62%,HIGH,139.73,RG=+69% with GrMgn=91% and fwd PE collapsing to 9.5x
2026-04-11,AI-EmergingGrowth,DLO,DLocal Limited,DLocal is the critical payment infrastructure laye,HIGH,13.12,RG accelerating from +15% to +47% with ROIC=29% and NetCash=+19%
2026-04-11,AI-EmergingGrowth,RELY,"Remitly Global, Inc.",Remitly is displacing Western Union and MoneyGram ,MEDIUM,16.86,EG5y=+39% with fwd PE=8.8x and MoS=85%
2026-04-11,AI-EmergingGrowth,APPF,"AppFolio, Inc.",AppFolio is the clear vertical SaaS winner in prop,HIGH,143.34,ROIC=22% rising with RG=+20% and FCFConv=1.7x at $5.2B market cap
2026-04-11,AI-EmergingGrowth,HALO,"Halozyme Therapeutics, Inc.",Halozyme's ENHANZE drug-delivery technology has be,HIGH,67.82,OprMgn=58% with RG=+38% accelerating from +22% and PEG=0.7
2026-04-11,AI-SpecialSit,HALO,"Halozyme Therapeutics, Inc.",Classic business model misclassification: market p,HIGH,67.82,PEG=0.7 with 58% operating margins and fwd PE=7.7 — pure royalty economics price
2026-04-11,AI-SpecialSit,PTCT,"PTC Therapeutics, Inc.",Extraordinary financial inflection: revenue explod,HIGH,68.69,ROIC=37% with 91% gross margins at PE=8.1 — profitable rare disease compounder p
2026-04-11,AI-SpecialSit,DLO,DLocal Limited,Emerging markets payment infrastructure misclassif,HIGH,13.12,MoS=84% with revenue reaccelerating to +47% and NetCash=+19% at PEG=0.8
2026-04-11,AI-SpecialSit,PEGA,Pegasystems Inc.,Structural pivot from perpetual license to SaaS/cl,HIGH,39.37,PEG=0.7 with ROIC=29% and RevGap=+97% — transition discount on a SaaS compounder
2026-04-11,AI-SpecialSit,QLYS,"Qualys, Inc.",Hidden FCF machine in cybersecurity — Qualys gener,HIGH,76.2,FCFMargin=46% with MoS=76% and NetCash=+13% at PE=13.8 — hidden FCF fortress
2026-04-11,AI-SpecialSit,DUOL,"Duolingo, Inc.",Turnaround inflection point almost completely unre,HIGH,90.03,"PEG=0.6 with +39% revenue growth, 36% FCF margins, and NetCash=+25% — first prof"
2026-04-11,AI-SpecialSit,HRB,"H&R Block, Inc.",Deep IV discount on a misunderstood durable franch,MEDIUM,29.8,"PE=6.1, PEG=0.4, FCF yield=14%, ROIC=30% — serial capital returner at liquidatio"
2026-04-12,AI-Judge,PEGA,Pegasystems Inc.,Quality Compounder,HIGH,39.37,The market thinks Pega is a tired legacy software vendor — it just completed a c
2026-04-12,AI-Judge,DOCS,"Doximity, Inc.",Stalwart,HIGH,21.05,"Doximity owns the LinkedIn for doctors — 80% of US physicians are on it, pharma "
2026-04-12,AI-Judge,HALO,Halozyme Therapeutics,Fast Grower,HIGH,67.82,The market prices Halozyme as a speculative biotech — it is actually a royalty m
2026-04-12,AI-Judge,QLYS,"Qualys, Inc.",Quality Compounder,HIGH,76.2,"Qualys is the boring, invisible cybersecurity machine generating 46% FCF margins"
2026-04-12,AI-Judge,DLO,DLocal Limited,Fast Grower,HIGH,13.12,DLocal built the only true payment infrastructure layer across 40+ emerging mark
2026-04-12,AI-EmergingGrowth,DLO,DLocal Limited,DLocal is the dominant payment infrastructure laye,HIGH,13.12,RG=+47% with ROIC=29% and FCFMargin=37% at $3.8B mcap
2026-04-12,AI-EmergingGrowth,DOCS,"Doximity, Inc.",Doximity owns the professional identity layer for ,HIGH,21.05,GrMgn=90% with RG=+20% accelerating from +13% and FCFMargin=49%
2026-04-12,AI-EmergingGrowth,DUOL,"Duolingo, Inc.",Duolingo is building the dominant global consumer ,HIGH,90.03,RG=+39% sustained (prior +41%) with MoS=77% and ROIC rapidly inflecting from 9%
2026-04-12,AI-EmergingGrowth,RDDT,"Reddit, Inc.",Reddit is the internet's largest repository of aut,HIGH,139.73,RG=+69% (prior +62%) with GrMgn=91% and fwd PE collapsing to 9.5x
2026-04-12,AI-EmergingGrowth,APPF,"AppFolio, Inc.",AppFolio is the cloud-native platform of record fo,HIGH,143.34,"ROIC=22% rising with RG=+20%, FCFConv=1.7x, and AltZ=21 (fortress balance sheet)"
2026-04-12,AI-EmergingGrowth,PEGA,Pegasystems Inc.,Pegasystems is an underappreciated enterprise soft,MEDIUM,39.37,"PEG=0.7 with ROIC=29%, GrMgn=76%, and RG inflecting from +5% to +17%"
2026-04-12,AI-EmergingGrowth,RELY,"Remitly Global, Inc.",Remitly is capturing the $1T+ global remittance ma,MEDIUM,16.86,"MoS=85% with RG=+29%, fwd PE=8.8x, and EG5y=+39% at $3.5B mcap"
2026-04-12,AI-CapAppreciation,PEGA,Pegasystems Inc.,Revenue re-acceleration from +5% to +17% signals t,HIGH,39.37,RG re-accelerated from +5% to +17% with PEG=0.7 and ROIC=29%
2026-04-12,AI-CapAppreciation,HALO,"Halozyme Therapeutics, Inc.",ENHANZE drug delivery royalty pipeline acceleratio,HIGH,67.82,FwdPE=7.7 vs trailing 25.2 with RG accelerating to +38%
2026-04-12,AI-CapAppreciation,PTCT,"PTC Therapeutics, Inc.",Dramatic revenue reversal from -14% to +115% drive,HIGH,68.69,Revenue inflection from -14% to +115% with PE=8.1 and OprMgn=49%
2026-04-12,AI-CapAppreciation,DOCS,"Doximity, Inc.",Revenue accelerating from +13% to +20% with best-i,HIGH,21.05,FCFMargin=49% with RG re-accelerating from +13% to +20% at PE=16.5
2026-04-12,AI-CapAppreciation,DLO,DLocal Limited,Revenue exploding from +15% to +47% as LatAm/Afric,HIGH,13.12,RG re-accelerated from +15% to +47% with MoS=84% and PEG=0.8
2026-04-12,AI-CapAppreciation,CNX,CNX Resources Corporation,Natural gas revenue inflecting from -8% to +59% as,MEDIUM,39.28,Revenue inflected from -8% to +59% with OprMgn=51% and PEG=0.5
2026-04-12,AI-CapAppreciation,RDDT,"Reddit, Inc.",Revenue sustaining +69% growth on top of +62% prio,MEDIUM,139.73,FwdPE=9.5 vs trailing 50.1 with sustained +69% revenue growth
2026-04-12,AI-QualityGrowth,ADBE,Adobe Inc.,Irreplaceable creative and document cloud platform,HIGH,225.35,ROIC=37% with FCFMargin=42% and perfectly flat revenue growth trend (11%/11%) co
2026-04-12,AI-QualityGrowth,PEGA,Pegasystems Inc.,Mission-critical low-code BPM and CRM platform emb,HIGH,39.37,PEG=0.7 with ROIC=29% and FCFConv=1.2 at only $6.7B market cap—deeply undervalue
2026-04-12,AI-QualityGrowth,QLYS,"Qualys, Inc.","Cloud-native cybersecurity platform with 28% ROIC,",HIGH,76.2,"FCFMargin=46% with MoS=76% and NetCash=+13%—rare combination of quality, value, "
2026-04-12,AI-QualityGrowth,DOCS,"Doximity, Inc.",Network-effect moat with 80%+ of US physicians on ,HIGH,21.05,GrMgn=90% with FCFMargin=49% and ROIC=20%—pure software economics from a network
2026-04-12,AI-QualityGrowth,HALO,"Halozyme Therapeutics, Inc.",Proprietary ENHANZE drug delivery technology licen,HIGH,67.82,OprMgn=58% with PEG=0.7 and ROIC=24%—platform royalty model means revenue growth
2026-04-12,AI-QualityGrowth,HIG,The Hartford Financial Service,Disciplined specialty commercial P&C insurer with ,HIGH,137.23,ROIC=28% sustained in Financial Services sector with PEG=0.8 and FCF=15%—best-in
2026-04-12,AI-QualityGrowth,FICO,Fair Isaac Corporation,Monopoly-grade scoring infrastructure with 51% ROI,HIGH,922.37,ROIC=51% is the single highest in the candidate universe—this is what a true str
2026-04-12,AI-SpecialSit,HALO,"Halozyme Therapeutics, Inc.",Classic business model misclassification: market p,HIGH,67.82,PEG=0.7 with fwd PE collapsing to 7.7x vs trailing 25.2x — earnings inflection a
2026-04-12,AI-SpecialSit,PEGA,Pegasystems Inc.,Structural mis-pricing from a multi-year SaaS tran,HIGH,39.37,ROIC=29% at PE=17x with PEG=0.7 — quality compounder priced as a declining softw
2026-04-12,AI-SpecialSit,PTCT,"PTC Therapeutics, Inc.",Regulatory and commercial inflection point massive,HIGH,68.69,FCFMargin=40% and ROIC=37% at PE=8.1x — orphan drug platform priced as a binary 
2026-04-12,AI-SpecialSit,QLYS,"Qualys, Inc.",Hidden FCF machine systematically ignored: 46% FCF,HIGH,76.2,MoS=76% with NetCash=+13% and FCFMargin=46% — fortress balance sheet SaaS at dee
2026-04-12,AI-SpecialSit,DUOL,"Duolingo, Inc.",Turnaround inflection mispriced: Duolingo just cro,HIGH,90.03,PEG=0.6 with 39% revenue growth and 25% net cash position — profitability inflec
2026-04-12,AI-SpecialSit,RELY,"Remitly Global, Inc.",Fintech turnaround with the hardest part behind it,MEDIUM,16.86,FwdPE=8.8x vs trailing 52x — earnings normalization inflection with 85% MoS not 
2026-04-12,AI-SpecialSit,NTES,"NetEase, Inc.",Extreme hidden asset play: NetEase carries net cas,MEDIUM,112.72,NetCash=+223% of market cap with FCFMargin=43% — operating business is effective
2026-04-12,AI-QualityGrowth,BKNG,Booking Holdings Inc.,Structurally dominant global OTA with 51% ROIC — t,HIGH,173.46,ROIC=51% with FCFMargin=34% and GrMgn=100% — the single strongest moat signal in
2026-04-12,AI-EmergingGrowth,HALO,"Halozyme Therapeutics, Inc.",Halozyme's ENHANZE drug-delivery technology has be,MEDIUM,67.82,OprMgn=58% with RG=+38% (prior year +22%) and PEG=0.7 at $8.0B mcap
2026-04-12,AI-CapAppreciation,CQP,"Cheniere Energy Partners, L.P.",LNG revenue surged +24% after -10% prior year as g,HIGH,62.95,PEG=0.2 with MoS=86% and ROIC=22% on re-accelerating revenue +24% vs -10% prior
2026-04-12,AI-CapAppreciation,CRDO,Credo Technology Group Holding,Hyperscaler AI infrastructure spend is driving 126,MEDIUM,119.59,"RG +126% with fwd PE=17.0 vs trailing 62.1, earnings inflection already underway"
2026-04-12,AI-SpecialSit,DLO,DLocal Limited,DLocal is a FinTech payments infrastructure compan,HIGH,13.12,PEG=0.8 with RG=+47% and FCFMargin=37% — hypergrowth FinTech priced as a value s
2026-04-12,AI-SpecialSit,HRB,"H&R Block, Inc.",H&R Block is a misclassified consumer-defensive re,HIGH,29.8,FCF yield=14% with ROIC=30% and PEG=0.4 — recurring-revenue franchise priced as 
2026-04-12,AI-Judge,BKNG,Booking Holdings Inc.,Quality Compounder,HIGH,173.46,A near-monopoly global OTA with 51% ROIC and 100% gross margins trades at a forw
2026-04-12,AI-EmergingGrowth,MNDY,monday.com Ltd.,monday.com is transitioning from project managemen,HIGH,58.81,GrMgn=89% with FwdPE=7.4 and NetCash=+45% of market cap
