date,source,ticker,company,strategy,conviction,entry_price,headline
2026-04-16,AI-Judge,TSM,Taiwan Semiconductor Manufactu,Quality Compounder,HIGH,375.1,Every AI chip in the world is manufactured here — and the market is giving you a
2026-04-16,AI-Judge,GOOGL,Alphabet Inc.,Quality Compounder,HIGH,337.12,The market prices GOOGL as a mature ad business under AI siege — the reality is 
2026-04-16,AI-EmergingGrowth,META,"Meta Platforms, Inc.",82% gross margin social platform with 22% revenue ,HIGH,671.58,GrMgn=82% with RG=+22% and ROIC rising to 18%
2026-04-16,AI-EmergingGrowth,NVDA,NVIDIA Corporation,63% ROIC with 65% revenue growth and 45% FCF margi,HIGH,198.87,ROIC=63% with FCFMargin=45% at RG=+65%
2026-04-16,AI-EmergingGrowth,MSFT,Microsoft Corporation,Azure and Copilot create a compounding platform fl,HIGH,411.22,FCFMargin=25% with ROIC=21% and GrMgn=69%
2026-04-16,AI-EmergingGrowth,GOOGL,Alphabet Inc.,Search monopoly generating 18% FCF margins funds a,HIGH,337.12,ROIC=22% with 52wPos=97% signalling institutional conviction
2026-04-16,AI-EmergingGrowth,TSM,Taiwan Semiconductor Manufactu,33% revenue growth with 25% ROIC and 25% FCF margi,HIGH,375.1,ROIC=25% with RG=+33% and FCFMargin=25%
2026-04-16,AI-EmergingGrowth,AMZN,"Amazon.com, Inc.",AWS cloud infrastructure growing at high double-di,MEDIUM,248.5,EG5y=+22% with GrMgn=50% inflecting toward high-margin mix
2026-04-16,AI-EmergingGrowth,AAPL,Apple Inc.,51% ROIC and 28% FCF margin on a $4T installed bas,MEDIUM,266.43,ROIC=51% with FCFMargin=28% and FCFConv=1.1
2026-04-16,AI-QualityGrowth,MSFT,Microsoft Corporation,Azure cloud + Office365 subscription flywheel crea,HIGH,411.22,ROIC=21% sustained + PEG=1.3 + FCFMargin=25% — rare quality-at-value combination
2026-04-16,AI-QualityGrowth,TSM,Taiwan Semiconductor Manufactu,The world's only manufacturer capable of leading-e,HIGH,375.1,ROIC=25% + OprMgn=51% + RG=+33% consistent — structural monopoly on advanced sem
2026-04-16,AI-QualityGrowth,NVDA,NVIDIA Corporation,CUDA software ecosystem lock-in means AI researche,HIGH,198.87,"ROIC=63% — the highest in the entire candidate set, driven by structural softwar"
2026-04-16,AI-QualityGrowth,GOOGL,Alphabet Inc.,Search advertising network effects (intent data fl,HIGH,337.12,ROIC=22% + NetCash=+1% + 52wPos=97% — quality compounder near highs with structu
2026-04-16,AI-QualityGrowth,META,"Meta Platforms, Inc.",3+ billion daily active users across Facebook/Inst,HIGH,671.58,GrMgn=82% + OprMgn=41% + RG=+22% consistent — best-in-class advertising economic
2026-04-16,AI-QualityGrowth,AAPL,Apple Inc.,The iOS/App Store/iCloud ecosystem creates unparal,MEDIUM,266.43,ROIC=51% + FCFConv=1.1 + FCFMargin=28% — ecosystem lock-in generates extraordina
2026-04-16,AI-QualityGrowth,AMZN,"Amazon.com, Inc.",AWS cloud infrastructure and Prime ecosystem flywh,MEDIUM,248.5,EG5y=+22% + PEG=1.6 — forward earnings power from AWS and advertising not yet re
2026-04-16,AI-CapAppreciation,MSFT,Microsoft Corporation,Azure AI monetization inflecting with Copilot seat,HIGH,411.22,52wPos=74% + EpsGap=+74% signals conservative guidance with imminent beat cycle
2026-04-16,AI-CapAppreciation,NVDA,NVIDIA Corporation,Blackwell GPU architecture ramp accelerating into ,HIGH,198.87,Forward PE=14.6 vs trailing PE=40.3 — earnings catching up to price within 2 qua
2026-04-16,AI-CapAppreciation,GOOGL,Alphabet Inc.,Search revenue resilience plus Gemini AI integrati,HIGH,337.12,RG accelerating +15% vs RGprev +14% with ROIC=22% and net cash positive at PEG=1
2026-04-16,AI-CapAppreciation,TSM,Taiwan Semiconductor Manufactu,Arizona fab ramp (Fab 21 Phase 2) reduces geopolit,HIGH,375.1,NetCash=+103% of price with ROIC=25% and N2 node ramp catalyst in H2 2026
2026-04-16,AI-CapAppreciation,META,"Meta Platforms, Inc.",Llama 4 open-source release and AI-driven ad targe,HIGH,671.58,GrMgn=82% + OprMgn=41% with RG=+22% at PE=28 — quality at a reasonable price
2026-04-16,AI-CapAppreciation,AAPL,Apple Inc.,Revenue re-acceleration from +2% to +6% is confirm,MEDIUM,266.43,RG re-accelerating +6% vs RGprev +2% with ROIC=51% and RevGap=+60% upside signal
2026-04-16,AI-CapAppreciation,AMZN,"Amazon.com, Inc.",AWS AI inference demand accelerating through mid-2,MEDIUM,248.5,EG5y=+22% at PEG=1.6 with AWS margin expansion catalyst in Q2 2026 earnings
2026-04-16,AI-SpecialSit,NVDA,NVIDIA Corporation,Market prices trailing PE of 40x but forward PE of,HIGH,198.87,fwd PE 14.6x vs trailing 40.3x — earnings catch-up alone is a 2.7x re-rating cat
2026-04-16,AI-SpecialSit,MSFT,Microsoft Corporation,Azure cloud + Copilot AI monetization is a royalty,HIGH,411.22,PEG 1.3 with 47% OprMgn and 25% FCFMargin — cheapest large-cap compounder in the
2026-04-16,AI-SpecialSit,TSM,Taiwan Semiconductor Manufactu,NetCash of +103% of price is a hidden asset the ma,HIGH,375.1,NetCash = +103% of market price — effectively buying the world's best semiconduc
2026-04-16,AI-SpecialSit,GOOGL,Alphabet Inc.,Market prices GOOGL as a mature ad company at risk,HIGH,337.12,Net cash positive (+1%) at PEG 1.7 with 22% ROIC — hidden asset value in Waymo/C
2026-04-16,AI-SpecialSit,META,"Meta Platforms, Inc.",Post-2022 efficiency restructuring has permanently,HIGH,671.58,82% GrMgn + 41% OprMgn at PEG 1.6 — best margin profile in Communication Service
2026-04-16,AI-SpecialSit,AMZN,"Amazon.com, Inc.",Amazon is a classic business model misclassificati,MEDIUM,248.5,PEG 1.6 vs Consumer Cyclical sector PEG of 6.0 — sector misclassification alone 
2026-04-16,AI-SpecialSit,WMT,Walmart Inc.,Walmart is misclassified as a low-margin grocer wh,MEDIUM,124.76,"20% DCF margin of safety — only stock in the candidate set with positive MoS, si"
2026-04-16,AI-EmergingGrowth,GOOG,Alphabet Inc.,Identical fundamental thesis to GOOGL but Class C ,MEDIUM,334.47,52wPos=96% with PEG=1.7 and OprMgn=32% — momentum and value alignment rare in me
2026-04-16,AI-Judge,BKNG,Booking Holdings Inc.,Quality Compounder,HIGH,185.92,The highest ROIC travel platform in the world at 51% is trading near fair value 
2026-04-16,AI-Judge,ADBE,Adobe Inc.,Quality Compounder,HIGH,246.63,The world's irreplaceable creative platform at 37% ROIC is trading at a 28% DCF 
2026-04-16,AI-SpecialSit,RELY,"Remitly Global, Inc.",Turnaround with hidden profitability inflection: f,MEDIUM,19.08,FwdPE=10.0 vs trailing PE=58.2 with RG=+29% and FCFConv=4.3
2026-04-16,AI-Judge,DLO,DLocal Limited,Fast Grower,HIGH,13.65,DLocal is the invisible payments infrastructure for 40+ emerging markets — growi
2026-04-16,AI-QualityGrowth,DLO,DLocal Limited,29% ROIC with 47% revenue growth reflects a struct,MEDIUM,13.65,ROIC=29% with RG=+47% and PEG=0.9
