date,source,ticker,company,strategy,conviction,entry_price,headline
2026-04-12,AI-CapAppreciation,CF,"CF Industries Holdings, Inc.",Revenue re-accelerated sharply from -10% to +19% a,HIGH,121.28,RG reversal: -10%→+19% with PEG=0.4 and MoS=62%
2026-04-12,AI-CapAppreciation,PLMR,"Palomar Holdings, Inc.",Premium specialty insurer with revenue re-accelera,HIGH,127.8,RG accelerating +47%→+58% with PEG=0.7 in hard insurance market
2026-04-12,AI-CapAppreciation,INTU,Intuit Inc.,Revenue re-accelerated from +13% to +16% as AI-ass,MEDIUM,350.94,Fwd PE=8.6 vs 22.6 trailing with RG re-acceleration +13%→+16%
2026-04-12,AI-SpecialSit,DOCS,"Doximity, Inc.","Physician network with 90% gross margins, 49% FCF ",MEDIUM,21.05,FCFMargin=49% with NetCash=+23% and zero debt at PE=16.5 — premium business at d
2026-04-12,AI-Judge,PTCT,PTC Therapeutics,Fast Grower,HIGH,68.69,"Revenue exploded from -14% to +115%, ROIC is 37%, FCF margins are 40%, and the s"
2026-04-12,AI-QualityGrowth,DLO,DLocal Limited,Emerging-market payments infrastructure with propr,MEDIUM,13.12,ROIC=29% with RG=+47% accelerating and PEG=0.8—rare GARP in high-barrier payment
2026-04-12,AI-SpecialSit,PLMR,"Palomar Holdings, Inc.",Specialty insurance turnaround with a catastrophe-,MEDIUM,127.8,"PEG=0.7 with 58% revenue growth accelerating, zero debt, and 46% FCF margin in a"
2026-04-13,AI-Judge,HALO,Halozyme Therapeutics,Fast Grower,HIGH,66.77,The market thinks it's a biotech gamble — it's actually a royalty toll booth on 
2026-04-13,AI-Judge,PEGA,Pegasystems Inc.,Quality Compounder,HIGH,41.34,A mission-critical enterprise software platform in the middle of a subscription 
2026-04-13,AI-Judge,DLO,DLocal Limited,Fast Grower,HIGH,13.53,The market treats this as a risky EM fintech — it's actually the dominant paymen
2026-04-13,AI-Judge,PTCT,PTC Therapeutics,Fast Grower,HIGH,69.99,"Revenue exploded 115% last year, ROIC is 37%, FCF margins are 41% — and it's tra"
2026-04-13,AI-Judge,QLYS,Qualys Inc.,IV Discount,HIGH,80.49,A debt-free cybersecurity SaaS with 46% FCF margins and a 75% DCF margin of safe
2026-04-13,AI-QualityGrowth,ADBE,Adobe Inc.,37% ROIC sustained by near-impenetrable creative a,HIGH,238.54,ROIC=37% with FCFMargin=42% and FCFConv=1.4
2026-04-13,AI-QualityGrowth,PEGA,Pegasystems Inc.,29% ROIC with PEG of 0.7 signals deeply undervalue,HIGH,41.34,PEG=0.7 with ROIC=29% and FCFConv=1.2
2026-04-13,AI-QualityGrowth,QLYS,"Qualys, Inc.","A pure-quality compounder with 28% ROIC, 46% FCF m",HIGH,80.49,FCFMargin=46% with MoS=75% and NetCash=+12%
2026-04-13,AI-QualityGrowth,BKNG,Booking Holdings Inc.,51% ROIC—the highest in this cohort—driven by a tw,HIGH,177.4,ROIC=51% with FCFMargin=34% and fwd PE=9.0
2026-04-13,AI-QualityGrowth,DOCS,"Doximity, Inc.",The dominant professional network for U.S. physici,HIGH,22.57,GrMgn=90% with FCFMargin=49% and ROIC=20%
2026-04-13,AI-QualityGrowth,HIG,The Hartford Financial Service,28% ROIC in insurance is exceptional and reflects ,HIGH,138.31,ROIC=28% with PEG=0.8 and FCF=15%
2026-04-13,AI-QualityGrowth,HALO,"Halozyme Therapeutics, Inc.",Halozyme's ENHANZE drug-delivery technology is pat,MEDIUM,66.77,PEG=0.7 with fwd PE=7.5 and FCFMargin=46%
2026-04-13,AI-CapAppreciation,PEGA,Pegasystems Inc.,Revenue re-accelerated sharply from +5% to +17% wh,HIGH,41.34,RG re-acceleration: +5% → +17% with PEG=0.7
2026-04-13,AI-CapAppreciation,DLO,DLocal Limited,Massive revenue re-acceleration from +15% to +47% ,HIGH,13.53,RG re-acceleration: +15% → +47% with MoS=84%
2026-04-13,AI-CapAppreciation,HALO,"Halozyme Therapeutics, Inc.",Revenue re-accelerated from +22% to +38% driven by,HIGH,66.77,FwdPE=7.5 vs trailing 24.9 — earnings step-change imminent
2026-04-13,AI-CapAppreciation,PTCT,"PTC Therapeutics, Inc.",Revenue exploded from -14% to +115% following Tran,HIGH,69.99,PE=8.3 on +115% revenue growth with 37% ROIC
2026-04-13,AI-CapAppreciation,CF,"CF Industries Holdings, Inc.",Revenue re-accelerated from -10% to +19% as nitrog,HIGH,121.51,PEG=0.4 with RG reversal: -10% → +19%
2026-04-13,AI-CapAppreciation,PLMR,"Palomar Holdings, Inc.",Specialty insurance compounder with revenue re-acc,HIGH,128.57,RG re-acceleration: +47% → +58% with PEG=0.7
2026-04-13,AI-CapAppreciation,CRDO,Credo Technology Group Holding,Revenue surged from +5% to +126% on AI datacenter ,MEDIUM,132.84,RG re-acceleration: +5% → +126% with FwdPE=18.8
2026-04-13,AI-EmergingGrowth,DLO,DLocal Limited,DLocal is the dominant payments infrastructure lay,HIGH,13.53,RG=+47% with ROIC=29% and FCFMargin=37% — rare proof that hypergrowth and capita
2026-04-13,AI-EmergingGrowth,DOCS,"Doximity, Inc.",Doximity owns the professional identity layer for ,HIGH,22.57,FCFMargin=49% with GrMgn=90% and ROIC=20% rising — platform economics fully visi
2026-04-13,AI-EmergingGrowth,DUOL,"Duolingo, Inc.",Duolingo is transitioning from a free app to a sub,HIGH,93.29,"PEG=0.7 with RG=+39% sustained, FCFMargin=36%, and 24% net cash buffer — deeply "
2026-04-13,AI-EmergingGrowth,PLMR,"Palomar Holdings, Inc.",Palomar is a specialty insurance underwriter using,HIGH,128.57,RG=+58% accelerating from +47% prior year with FCFMargin=46% and PEG=0.7 at only
2026-04-13,AI-EmergingGrowth,RELY,"Remitly Global, Inc.",Remitly is compressing the $700B global remittance,MEDIUM,17.32,FwdPE=9.1 vs trailing 53.3 with RG=+29% and MoS=85% — the earnings inflection is
2026-04-13,AI-EmergingGrowth,HALO,"Halozyme Therapeutics, Inc.",Halozyme's ENHANZE drug delivery technology is a r,HIGH,66.77,RG=+38% accelerating from +22% with OprMgn=58% and FwdPE=7.5 — highest-quality r
2026-04-13,AI-EmergingGrowth,MNDY,monday.com Ltd.,monday.com is evolving from a work-management tool,MEDIUM,62.15,GrMgn=89% with FwdPE=7.8 and NetCash=+42% — quality SaaS platform priced at deep
2026-04-13,AI-SpecialSit,HALO,"Halozyme Therapeutics, Inc.",Market prices HALO as a speculative biotech but it,HIGH,66.77,Fwd PE 7.5x vs trailing 24.9x with 58% operating margin and 82% gross margin — r
2026-04-13,AI-SpecialSit,PTCT,"PTC Therapeutics, Inc.",Revenue exploded +115% YoY (reversing -14% prior y,HIGH,69.99,Revenue +115% YoY with 91% gross margin and 41% FCF margin at PE=8.3x — market a
2026-04-13,AI-SpecialSit,QLYS,"Qualys, Inc.",Classic IV discount: a capital-light cybersecurity,HIGH,80.49,"75% DCF margin of safety with 46% FCF margin, 12% net cash/price, and PE=14.6x f"
2026-04-13,AI-SpecialSit,PEGA,Pegasystems Inc.,Pegasystems is undergoing a classic business model,HIGH,41.34,"PEG=0.7 with 60% ROE, 29% ROIC, 28% FCF margin, and +97% revenue gap signaling s"
2026-04-13,AI-SpecialSit,DLO,DLocal Limited,DLocal is a payments infrastructure business servi,HIGH,13.53,"84% DCF margin of safety with PEG=0.9, +47% revenue growth, 29% ROIC, and 19% ne"
2026-04-13,AI-SpecialSit,DUOL,"Duolingo, Inc.",Duolingo is classified as a Turnaround but the tur,HIGH,93.29,PE=10.5x with PEG=0.7 on +39% revenue growth and 36% FCF margin — market still p
2026-04-13,AI-SpecialSit,HIG,The Hartford Financial Service,Hartford is a misclassified compounder: the market,MEDIUM,138.31,15% FCF yield with 28% ROIC and 49% MoS at PE=10x — best-in-class underwriting e
2026-04-14,AI-Judge,PEGA,Pegasystems Inc.,Quality Compounder,HIGH,41.58,Every Fortune 500 bank and insurer runs on Pega — and the market thinks it's a s
2026-04-14,AI-Judge,HALO,Halozyme Therapeutics,Quality Compounder,HIGH,66.98,Halozyme is a pharma toll road disguised as a biotech — the market is charging b
2026-04-14,AI-Judge,DLO,DLocal Limited,Fast Grower,HIGH,13.65,DLocal is the only payment rail connecting 40 emerging markets — and the market 
2026-04-14,AI-Judge,PLMR,Palomar Holdings,Fast Grower,HIGH,128.38,The fastest-growing specialty insurer in America trades at the same multiple as 
2026-04-14,AI-Judge,QLYS,Qualys Inc.,IV Discount,HIGH,81.4,A cybersecurity fortress generating 46% FCF margins trades at a 75% discount to 
2026-04-14,AI-CapAppreciation,PEGA,Pegasystems Inc.,Revenue re-accelerated sharply from +5% to +17% Yo,HIGH,41.58,RG re-acceleration: +5% → +17% with PEG=0.7
2026-04-14,AI-CapAppreciation,DLO,DLocal Limited,Revenue exploded from +15% to +47% with ROIC of 29,HIGH,13.65,RG re-acceleration: +15% → +47% with MoS=84%
2026-04-14,AI-CapAppreciation,PTCT,"PTC Therapeutics, Inc.",Revenue surged from -14% to +115% driven by Transl,HIGH,70.42,RG swing: -14% → +115% at PE=8.3x
2026-04-14,AI-CapAppreciation,HALO,"Halozyme Therapeutics, Inc.",Revenue accelerated from +22% to +38% with a forwa,HIGH,66.98,Fwd PE=7.6 vs trailing 24.9 with RG=+38%
2026-04-14,AI-CapAppreciation,CF,"CF Industries Holdings, Inc.",Revenue inflected from -10% to +19% as nitrogen fe,HIGH,121.67,RG inflection: -10% → +19% with PEG=0.4
2026-04-14,AI-CapAppreciation,PLMR,"Palomar Holdings, Inc.",Specialty insurance compounder with revenue accele,HIGH,128.38,RG acceleration: +47% → +58% at PEG=0.7
2026-04-14,AI-CapAppreciation,CRDO,Credo Technology Group Holding,Revenue surged from +5% to +126% on AI data center,MEDIUM,134.36,RG re-acceleration: +5% → +126% with Fwd PE=19.1
2026-04-14,AI-QualityGrowth,ADBE,Adobe Inc.,Unassailable creative and document cloud monopoly ,HIGH,240.11,ROIC=37% with FCFMargin=42% and FCFConv=1.4 — earnings are exceptionally real
2026-04-14,AI-QualityGrowth,PEGA,Pegasystems Inc.,Mission-critical BPM and CRM software embedded dee,HIGH,41.58,PEG=0.7 with ROIC=29% and FCFMargin=28% — rare quality-growth combination
2026-04-14,AI-QualityGrowth,QLYS,"Qualys, Inc.",Cloud-native cybersecurity platform with 83% gross,HIGH,81.4,MoS=75% with ROIC=28% and NetCash=+12% — quality compounder at deep value
2026-04-14,AI-QualityGrowth,BKNG,Booking Holdings Inc.,The dominant global OTA network effect — supplier ,HIGH,177.25,ROIC=51% with GrMgn=100% and fwd PE=8.9 — the most capital-efficient travel busi
2026-04-14,AI-QualityGrowth,DOCS,"Doximity, Inc.",The dominant professional network for U.S. physici,HIGH,22.66,FCFMargin=49% with GrMgn=90% and NetCash=+21% — asset-light network printing cas
2026-04-14,AI-QualityGrowth,HIG,The Hartford Financial Service,Hartford's commercial lines underwriting excellenc,HIGH,139.07,ROIC=28% with PEG=0.8 and FCF=15% — highest-quality insurance compounder in the 
2026-04-14,AI-QualityGrowth,HALO,"Halozyme Therapeutics, Inc.",ENHANZE drug delivery technology is a platform roy,MEDIUM,66.98,OprMgn=58% with PEG=0.7 and FCFConv=2.0 — royalty model with zero competition ri
2026-04-14,AI-EmergingGrowth,DLO,DLocal Limited,DLocal is the dominant emerging-market payment inf,HIGH,13.65,"RG=+47% with ROIC=29% and MoS=84% — the rarest trifecta of fast growth, proven r"
2026-04-14,AI-EmergingGrowth,DUOL,"Duolingo, Inc.",Duolingo is building a consumer education platform,HIGH,93.53,MoS=76% with RG=+39% and FCFMargin=36% — profitable hypergrowth at a discount
2026-04-14,AI-EmergingGrowth,DOCS,"Doximity, Inc.",Doximity owns the professional network of US physi,HIGH,22.66,GrMgn=90% with FCFMargin=49% and ROIC=20% rising — near-monopoly economics in ph
2026-04-14,AI-EmergingGrowth,RELY,"Remitly Global, Inc.",Remitly is displacing legacy remittance players (W,HIGH,17.31,MoS=85% with fwd PE=9.1 vs trail 53.3 — the market hasn't priced the imminent ea
2026-04-14,AI-EmergingGrowth,PEGA,Pegasystems Inc.,Pegasystems is an enterprise AI decisioning and wo,HIGH,41.58,PEG=0.7 with ROIC=29% and FCFMargin=28% — quality compounder priced like a value
2026-04-14,AI-EmergingGrowth,PLMR,"Palomar Holdings, Inc.",Palomar is a specialty insurance disruptor focused,HIGH,128.38,RG=+58% accelerating from +47% with PEG=0.7 and FCFMargin=46% — fastest-growing 
2026-04-14,AI-EmergingGrowth,MNDY,monday.com Ltd.,monday.com is a work-management platform with plat,MEDIUM,63.55,fwd PE=8.0 vs trail 27.2 with GrMgn=89% and NetCash=+41% — platform economics ab
2026-04-14,AI-SpecialSit,HALO,"Halozyme Therapeutics, Inc.",Misclassified as biotech when it is actually a pur,HIGH,66.98,FwdPE=7.6 vs trailing PE=24.9 with 46% FCF margin and PEG=0.7
2026-04-14,AI-SpecialSit,PEGA,Pegasystems Inc.,Classic business model transition mispricing: Pega,HIGH,41.58,RevGap=+97% masking true earnings power with ROIC=29% and PEG=0.7
2026-04-14,AI-SpecialSit,PTCT,"PTC Therapeutics, Inc.",Rare inflection point: revenue surged +115% (from ,HIGH,70.42,PE=8.3 with ROIC=37% and FCFMargin=41% after +115% revenue inflection
2026-04-14,AI-SpecialSit,QLYS,"Qualys, Inc.",A deeply misunderstood asset play masquerading as ,HIGH,81.4,MoS=75% with NetCash=+12% and FCFMargin=46% at PEG=1.5
2026-04-14,AI-SpecialSit,DLO,DLocal Limited,Structural mispricing of an emerging-market paymen,HIGH,13.65,MoS=84% with PEG=0.9 and RG=+47% accelerating from +15% prior year
2026-04-14,AI-SpecialSit,HRB,"H&R Block, Inc.",Textbook IV discount: a near-monopoly consumer tax,HIGH,31.17,PE=6.4 with FCF=13% yield and ROIC=30% at PEG=0.5
2026-04-14,AI-SpecialSit,PLMR,"Palomar Holdings, Inc.",Financial inflection point in specialty insurance:,MEDIUM,128.38,PEG=0.7 with RG=+58% accelerating and FCFMargin=46%
2026-04-14,AI-Judge,DOCS,"Doximity, Inc.",Stalwart,HIGH,22.66,"The LinkedIn of medicine — 80% of US doctors use it, pharma has no alternative f"
2026-04-14,AI-QualityGrowth,DLO,DLocal Limited,Single-API payment infrastructure connecting globa,MEDIUM,13.65,PEG=0.9 with ROIC=29% and MoS=84%—fastest growing stock with best valuation-qual
2026-04-14,AI-CapAppreciation,DOCS,"Doximity, Inc.",Physician platform ad revenue re-accelerated to +2,HIGH,22.66,FCFMargin=49% with RG re-accelerating from +13% to +20%
2026-04-14,AI-SpecialSit,HIG,The Hartford Financial Service,Insurance underwriter at a clear FCF inflection: 1,HIGH,139.07,"FCF=15% yield with PE=10x, PEG=0.8, ROIC=28%, MoS=49% — cheapest high-quality in"
2026-04-14,AI-SpecialSit,DUOL,"Duolingo, Inc.",Turnaround with hidden profitability inflection: t,MEDIUM,93.53,"PEG=0.7 with first-ever GAAP profit inflection, FCFMargin=36%, NetCash=24%, RG=+"
2026-04-14,AI-Judge,MNDY,monday.com Ltd.,Turnaround,HIGH,63.55,You are buying a profitable 27%-growth SaaS business for effectively $2 billion 
2026-04-14,AI-EmergingGrowth,RDDT,"Reddit, Inc.",Unique community-driven platform with irreplaceabl,HIGH,149.29,RG=+69% sustained from +62% prior year with fwd PE=10.1 vs trail PE=53
2026-04-14,AI-EmergingGrowth,HALO,"Halozyme Therapeutics, Inc.",Capital-light royalty-and-licensing platform whose,HIGH,66.98,OprMgn=58% with RG=+38% accelerating from +22% and fwd PE=7.6
2026-04-14,AI-CapAppreciation,DUOL,"Duolingo, Inc.",At 17% of 52-week high with 39% revenue growth and,HIGH,93.53,52wPos=17% — deepest beaten-down quality name with intact 39% revenue growth
2026-04-14,AI-CapAppreciation,MNDY,monday.com Ltd.,Trading at 20% of 52-week high with fwd PE of 8x v,HIGH,63.55,FwdPE=8.0x vs trailing 27.2x — 70% earnings multiple expansion opportunity on ma
2026-04-14,AI-CapAppreciation,QLYS,"Qualys, Inc.","At 52% of 52-week high with 75% MoS, 46% FCF margi",HIGH,81.4,MoS=75% + FCFMargin=46% — rare combination of deep value and high quality in cyb
2026-04-14,AI-CapAppreciation,INTU,Intuit Inc.,At 45% of 52-week high with fwd PE of 9x vs 23.6x ,MEDIUM,369.44,FwdPE=9.0x — most extreme forward discount for a 16% revenue grower with 81% gro
2026-04-14,AI-SpecialSit,MNDY,monday.com Ltd.,Turnaround inflection where trailing ROIC is near ,HIGH,63.55,Net cash = 41% of market cap with fwd PE=8.0 — investors are paying ~$2B for a p
2026-04-14,AI-SpecialSit,RELY,"Remitly Global, Inc.",Classic turnaround inflection: trailing PE=53 coll,MEDIUM,17.31,Fwd PE=9.1 vs trailing PE=53.3 — a 6x P/E compression opportunity as profitabili
2026-04-14,AI-SpecialSit,BAH,Booz Allen Hamilton Holding Co,Hidden government IT services compounder being re-,MEDIUM,81.81,MoS=84% with PE=12 and FCF yield=9% — the DOGE panic has created a rare margin-o
2026-04-14,AI-Judge,DUOL,"Duolingo, Inc.",Turnaround,HIGH,93.95,"At only 17% of its 52-week high, the market has completely abandoned a 39% reven"
2026-04-14,AI-CapAppreciation,FICO,Fair Isaac Corporation,Dominant credit scoring monopoly at 46% of 52w hig,HIGH,1017.15,Fwd PE=13.5 vs trailing 36.1 — earnings power restoration implies 160% multiple 
2026-04-14,AI-SpecialSit,BZ,Kanzhun Limited,Pure asset play with a hidden balance sheet — NetC,MEDIUM,13.65,NetCash=+312% of market cap — the entire operating business is essentially free 
2026-04-14,AI-SpecialSit,PYPL,"PayPal Holdings, Inc.",Turnaround at a verifiable financial inflection — ,MEDIUM,48.08,FCF yield=13% at PE=8.5 with PEG=0.7 — the market is pricing existential risk on
2026-04-14,AI-SpecialSit,LB,LandBridge Company LLC,Structural misclassification as a simple energy ro,MEDIUM,67.08,FwdPE=13.6 vs TrailingPE=62.8 with FCFMargin=70% and GrMgn=92% — royalty economi
2026-04-16,AI-Judge,HALO,Halozyme Therapeutics,Fast Grower,HIGH,67.44,The toll-road on Big Pharma's drug delivery that the market still prices as a ri
2026-04-16,AI-Judge,PEGA,Pegasystems Inc.,Quality Compounder,HIGH,42.71,Mission-critical enterprise AI platform misread as legacy software finally relea
2026-04-16,AI-Judge,QLYS,"Qualys, Inc.",IV Discount,HIGH,85.58,The most boring stock on this list is also the clearest case of a moat business 
2026-04-16,AI-Judge,DOCS,"Doximity, Inc.",Stalwart,HIGH,23.75,The LinkedIn for US doctors has already won — 80% network penetration means ever
2026-04-16,AI-Judge,MNDY,monday.com Ltd.,Turnaround,HIGH,65.01,"At 21% of its 52-week high with 40% of market cap in net cash, the market is pri"
2026-04-16,AI-QualityGrowth,ADBE,Adobe Inc.,Irreplaceable creative and document cloud platform,HIGH,245.3,ROIC=37% with FCFMargin=42% and PEG=1.5 at PE=13.9 — exceptional quality at a re
2026-04-16,AI-QualityGrowth,PEGA,Pegasystems Inc.,Mission-critical low-code BPM and CRM platform emb,HIGH,42.71,PEG=0.8 with ROIC=29% and FCFMargin=28% — moat-confirmed growth at a deep discou
2026-04-16,AI-QualityGrowth,QLYS,"Qualys, Inc.","Cloud-native cybersecurity platform with 28% ROIC,",HIGH,85.58,MoS=74% with FCFMargin=45% and ROIC=28% — the clearest value-quality combination
2026-04-16,AI-QualityGrowth,HIG,The Hartford Financial Service,Specialty commercial insurance franchise with stru,HIGH,139.4,ROIC=28% with FCF=15% and PEG=0.8 — highest FCF yield on screen with moat-confir
2026-04-16,AI-QualityGrowth,BKNG,Booking Holdings Inc.,Network-effect-driven online travel marketplace wi,HIGH,186.18,ROIC=51% with GrMgn=100% and OprMgn=34% — the strongest moat economics in the en
2026-04-16,AI-QualityGrowth,DOCS,"Doximity, Inc.",Dominant physician professional network with 20% R,HIGH,23.75,FCFMargin=49% with GrMgn=90% and NetCash=+20% — asset-light compounder with fort
2026-04-16,AI-QualityGrowth,HALO,"Halozyme Therapeutics, Inc.",ENHANZE drug delivery technology platform generate,MEDIUM,67.44,PEG=0.7 with OprMgn=58% and FCFMargin=46% — royalty-model economics at a fast-gr
2026-04-16,AI-EmergingGrowth,DLO,DLocal Limited,The dominant payment infrastructure for emerging m,HIGH,13.5,RG=+47% with ROIC=29% and FCFMargin=37% — growth is profitable
2026-04-16,AI-EmergingGrowth,DOCS,"Doximity, Inc.",The LinkedIn for US physicians has achieved near-m,HIGH,23.75,GrMgn=90% and FCFMargin=49% at 20% revenue growth — a pure SaaS compounder
2026-04-16,AI-EmergingGrowth,RDDT,"Reddit, Inc.",Reddit owns the internet's most authentic communit,HIGH,158.58,RG=+69% sustained (RGprev=+62%) with 91% gross margin and fwd PE=10.7x vs traili
2026-04-16,AI-EmergingGrowth,DUOL,"Duolingo, Inc.",The world's largest language-learning platform wit,HIGH,97.5,"RG=+39% (RGprev=+41%) with FCFMargin=37% and NetCash=+23% — durable growth, no d"
2026-04-16,AI-EmergingGrowth,MNDY,monday.com Ltd.,"A work-OS platform with 27% revenue growth, 89% gr",MEDIUM,65.01,FCFMargin=26% and fwd PE=8.2x vs trailing 28.5x — profitable pivot not yet price
2026-04-16,AI-EmergingGrowth,RELY,"Remitly Global, Inc.",The fastest-growing digital remittance platform (2,MEDIUM,18.89,"EG5y=+39% with fwd PE=9.9x — the market is pricing this as a cyclical, not a com"
2026-04-16,AI-EmergingGrowth,HALO,"Halozyme Therapeutics, Inc.",Halozyme's ENHANZE drug-delivery platform is a tol,HIGH,67.44,OprMgn=58% with RG=+38% and fwd PE=7.6x — a royalty compounder deeply mispriced
2026-04-16,AI-CapAppreciation,PEGA,Pegasystems Inc.,Revenue re-accelerated sharply from +5% to +17% wi,HIGH,42.71,RG re-acceleration from +5% to +17% with PEG=0.8
2026-04-16,AI-CapAppreciation,MNDY,monday.com Ltd.,At only 21% of 52-week high with a forward PE of 8,HIGH,65.01,52wPos=21% with fwd PE collapsing to 8.2x vs 28.5x trailing
2026-04-16,AI-CapAppreciation,HALO,"Halozyme Therapeutics, Inc.",ENHANZE royalty pipeline is accelerating with RG f,HIGH,67.44,PEG=0.7 with fwd PE of 7.6x vs 25.1x trailing on accelerating royalties
2026-04-16,AI-CapAppreciation,FICO,Fair Isaac Corporation,At 47% of 52-week high with ROIC of 51% and revenu,HIGH,1032,52wPos=47% with ROIC=51% and fwd PE compressing to 13.7x
2026-04-16,AI-CapAppreciation,INTU,Intuit Inc.,At 48% of 52-week high with revenue re-acceleratin,HIGH,390.28,52wPos=48% with fwd PE=9.5x and RG accelerating to +16%
2026-04-16,AI-CapAppreciation,PATH,UiPath Inc.,Revenue re-accelerated from +9% to +13% with 52wPo,MEDIUM,10.55,NetCash=+25% with RG re-accelerating from +9% to +13% and PEG=1.1
2026-04-16,AI-CapAppreciation,ALNY,"Alnylam Pharmaceuticals, Inc.",Revenue exploded from +23% to +65% driven by Leqvi,MEDIUM,335.64,RG surge to +65% with fwd PE of 17.4x vs 141x trailing signaling trough earnings
2026-04-16,AI-SpecialSit,HALO,"Halozyme Therapeutics, Inc.",Business model misclassification: market prices HA,HIGH,67.44,FwdPE=7.6x vs trailing 25x with 38% revenue growth and 46% FCF margin — royalty 
2026-04-16,AI-SpecialSit,PTCT,"PTC Therapeutics, Inc.",Regulatory and commercial inflection: revenue expl,HIGH,73.09,"PE=8.7 with ROIC=37%, 91% gross margin, and 41% FCF margin on +115% revenue grow"
2026-04-16,AI-SpecialSit,PEGA,Pegasystems Inc.,Business model inflection point: Pegasystems compl,HIGH,42.71,"PEG=0.8 with ROIC=29%, 28% FCF margin, and +97% RevGap showing deferred revenue "
2026-04-16,AI-SpecialSit,DLO,DLocal Limited,Emerging market payments rails misclassified as a ,HIGH,13.5,"PEG=0.9 with ROIC=29%, +47% revenue growth, FCF conversion of 2.1x, and net cash"
2026-04-16,AI-SpecialSit,QLYS,"Qualys, Inc.",Hidden compounding quality at a deep discount: Qua,HIGH,85.58,"74% DCF margin of safety with 45% FCF margin, net cash=11% of market cap, and RO"
2026-04-16,AI-SpecialSit,BAH,Booz Allen Hamilton Holding Co,Turnaround misread: the market is pricing BAH as i,MEDIUM,82.64,MoS=85% with FCF yield=9% and ROIC=18% while trading at 63% of 52-week high on t
2026-04-16,AI-SpecialSit,MNDY,monday.com Ltd.,Turnaround inflection mis-timed: monday.com is at ,MEDIUM,65.01,"Net cash = 40% of market cap, fwd PE = 8.2x with 89% gross margins and FCF yield"
2026-04-16,AI-Judge,DUOL,"Duolingo, Inc.",Turnaround,HIGH,98.78,Duolingo crossed into GAAP profitability while growing 39% — the stock at 18% of
2026-04-16,AI-QualityGrowth,GDDY,GoDaddy Inc.,Deeply embedded small-business digital platform wi,MEDIUM,82.33,PEG=0.5 with FCF=14% and EG5y=+24%
2026-04-16,AI-CapAppreciation,QLYS,"Qualys, Inc.",Beaten-down cybersecurity compounder at 55% of 52w,HIGH,85.17,MoS=74% with FCFMargin=46% at only PE=15.4
2026-04-16,AI-CapAppreciation,DUOL,"Duolingo, Inc.",At only 18% of 52w high with 75% DCF margin of saf,HIGH,98.78,52wPos=18% with RG=+39% and MoS=75%
2026-04-16,AI-CapAppreciation,DOCS,"Doximity, Inc.",At only 31% of 52w high despite revenue re-acceler,HIGH,23.9,52wPos=31% with RG accelerating to +20% from +13%
2026-04-16,AI-EmergingGrowth,PATH,UiPath Inc.,UiPath's robotic process automation platform sits ,MEDIUM,10.61,GrMgn=83% with NetCash=+25% and MoS=55% vs DCF
2026-04-16,AI-SpecialSit,DUOL,"Duolingo, Inc.",Tagged as a Turnaround but actually a structural i,HIGH,98.78,52wPos=18% with RG=+39% and MoS=75%
2026-04-16,AI-SpecialSit,HIG,The Hartford Financial Service,Structural mis-pricing of a best-in-class P&C comp,HIGH,138.75,FCF=15% with ROIC=28% and MoS=50% at PEG=0.8
2026-04-16,AI-EmergingGrowth,ESTC,Elastic N.V.,Search and observability platform deeply embedded ,MEDIUM,47.51,ROIC=61% with GrMgn=76% and NetCash=+16% at only $4.9B market cap
2026-04-16,AI-CapAppreciation,PTCT,"PTC Therapeutics, Inc.",Explosive revenue re-acceleration from -14% to +11,HIGH,73.57,RG re-accelerating to +115% from -14% with ROIC=37%
2026-04-16,AI-QualityGrowth,FICO,Fair Isaac Corporation,FICO Score is a regulatory and contractual standar,HIGH,1030.81,"ROIC=51%—highest moat signal in the dataset, reflecting genuine pricing power no"
2026-04-16,AI-QualityGrowth,INCY,Incyte Corporation,Jakafi's established market position in rare blood,MEDIUM,97.1,PEG=0.7 with ROIC=21% and GrMgn=92%—compelling quality-growth value in a sector 
2026-04-16,AI-SpecialSit,HRB,"H&R Block, Inc.",Classic IV discount on a misclassified asset: mark,HIGH,30.91,FCF=13% yield with ROIC=30% at PE=6.4 and MoS=77% — exceptional cash economics a
2026-04-16,AI-CapAppreciation,PTC,PTC Inc.,Industrial IoT and PLM SaaS with revenue re-accele,MEDIUM,136.58,RG acceleration from +10% to +19% with PEG=1.1 and OprMgn=38%
2026-04-16,AI-SpecialSit,PYPL,"PayPal Holdings, Inc.",PayPal is in a genuine operational turnaround unde,HIGH,49.57,FCF yield=12% with PE=8.8 and 54% MoS — market pricing terminal decline on a bus
2026-04-16,AI-Judge,NVDA,NVIDIA Corporation,IV Discount,HIGH,198.87,The market is still reading NVDA's rearview mirror — the forward PE is 14.6x on 
2026-04-16,AI-Judge,MSFT,Microsoft Corporation,Quality Compounder,HIGH,411.22,The cheapest large-cap AI compounder alive — PEG 1.3 on a business with 21% ROIC
2026-04-16,AI-Judge,META,"Meta Platforms, Inc.",Stalwart,HIGH,671.58,"3 billion daily users, 82% gross margins, PE of 28 — the market is still pricing"
